"id","episode_id","event","speaker","text"
"35,056",148,Speech,Tony Jones,"Thank you. So that was I Can Change Your Mind About Climate Change and joining our panel for this special edition of Q&A tonight, the director of the Ipsos Mackay Report, public opinion researcher, Rebecca Huntley; mining magnate Clive Palmer; the co-stars of our documentary, climate change campaigner Anna Rose and climate sceptic Nick Minchin; and the chief executive of the CSIRO, Australia's leading science organisation, Megan Clark. Please welcome our panel."
"35,057",148,Speech,Tony Jones,"Well, our audience represents a wide range of views on climate change, plus a handful of expert voices in the audience so you can join the Twitter conversation using the hash tag on your screen and keep an eye out for your chance to share your opinions on qandavote.tv. Our first question comes from in the audience. It's from Jenny Curtis."
"35,058",148,Speech,Jenny Curtis,"Thank you. Firstly, I'd like to acknowledge the enormous contribution that coal has made to our modern lives here in Australia and to the mining families that have helped build what we have today. Having said that, as a mother of three school-aged children, I'm gravely concerned about our continuing use of fossil fuels. Given that the energy departments in India, China and the USA are all saying that solar will provide electricity cheaper than coal in the next few years, when will Australia's politicians and business leaders start the real transition work that the other countries are well ahead of us on and by investing in large scale solar? And do you think that there is any chance that we will cease digging, using and selling our toxic fossil fuels - our toxic fossil fuel resources before they run out?"
"35,059",148,Speech,Tony Jones,"Okay, let's start with Nick Minchin, because you do want to bring this back to an energy debate, as you've just said in the documentary. You'd like to efficiently harness the energy of the sun."
"35,060",148,Speech,Nick Minchin,"I think it is an energy debate and I welcome that question and I think it's appropriate for you to thank all those who have been part of the coal industry and the coal industry, I think it's still our biggest export industry. It employs thousands upon thousands of Australians. It has been a great industry and it has enabled Australia to have value adding industries because we've had a comparative advantage in cheap energy. So we should all be very grateful that we are blessed with some of the greatest coal resources in the world. I mean, I say in that documentary that ultimately because, by definition, these fossil fuel resources are finite, that humanity will make a transition at some point to alternative fuels and there'll be transitional fuels. It might be hydrogen, it might be nuclear, it might be, you know, more gas in the meantime."
"35,061",148,Speech,Tony Jones,We see you in the documentary championing solar power.
"35,062",148,Speech,Nick Minchin,"I suppose I'm in the Lomborg camp and I'm really pleased that I arranged for us to go and see Bjorn Lomborg. I think he's a really interesting guy and he makes the point that what we should be trying to do, and I support this, is putting more of our effort into research and development into making things like solar affordable and cost competitive because at the moment it is simply not cost competitive..."
"35,063",148,Speech,Tony Jones,Do you agree with him on the...
"35,064",148,Speech,Nick Minchin,...and I don't agree...
"35,065",148,Speech,Tony Jones,Do you agree with him on the hundred billion dollars a year he says needs to be spent?
"35,066",148,Speech,Nick Minchin,"Well, he's taking it as a proportion of global GDP. I think that would be much better spent on R&D into solar than on trying to mitigate uselessly emissions of CO2 from human activity, which will make basically no difference to the temperature of the planet."
"35,067",148,Speech,Tony Jones,"Okay, let's go to Anna Rose. Did you think watching Nick Minchin there that he was making a big shift?"
"35,068",148,Speech,Anna Rose,"I felt it was a breakthrough moment when we did reach our agreement that we need to move Australia away from fossil fuels. As Jenny said they are harming our environment. They're harming our health and we live in a country that is the sunniest country in the world, one of the windiest. If we can't transition to renewable energy here no one can do it. But at the moment Australia is not leading, by any stretch of the imagination, on renewable energy. In fact we're lagging behind. Now, there are 130 moving parts in a wind turbine. Who do we want to be manufacturing those parts? Do we want them to be made overseas or do we want them to be made here with Australian workers. Now, Nick mentioned that there's a lot of people that work in the coal industry. That's true but actually more people are directly employed at Bunnings than in coal mining and we need to be looking for a future where we're creating new jobs, new industries, innovation and, most importantly, stopping the harm that the coal industry is doing to our environment. And I won't even get started on the Great Barrier Reef, which is about to potentially be destroyed by digging up the Galilee Basin, which is the third largest carbon source in the world and then having ships going through the reef to export that and cause climate change everywhere else."
"35,069",148,Speech,Tony Jones,"Okay, we've got a video question on the solar power question. It comes from Darren Lewin-Hill. We'll go to that before we come to the rest of our panellists. He's in Northcote Victoria."
"35,070",148,Speech,Darren Lewin-Hill,"Clive Palmer, clean coal may never prove workable. Concentrated solar thermal power is operating right now in Spain and is capable of supplying base-load power here in Australia. Why don't you throw your billions behind such renewable, zero-emissions technologies instead of high-emissions coal, which causes health and environmental damage on top of its proven contribution to climate change?"
"35,071",148,Speech,Tony Jones,Clive Palmer?
"35,072",148,Speech,Clive Palmer,"Well, first of all I'd say that we have to realise we all are mortal. We all live on a small planet. We all breathe the same air. I think all of us want a good future for our children and I think we want the sort of future that we've had in Australia, the lifestyle we've got. If you go to India, China and other countries, there's over two billion, nearly three billion people in Asia and elsewhere that have got a very subsistent life that deserve a better future. We've had the benefits of building our economy with coal on a sustainable grown rate and it's easy for us to say we'll deny you and your family that opportunity. I don't think overall that's good for Australia. I don't think it's good for the region and there isn't any other fuel at the moment which is competitive with coal. If there was we should be using it. Now, if you don't believe me, if you're really committed, turn off your television set, turn off this light, because we're all benefitting. That documentary, 30 tonnes of carbon dioxide was used in making that documentary. We shouldn't have done it, if we really believe that. You shouldn't have gone on the airplane but you did. 97 per cent of carbon dioxide is by natural sources."
"35,073",148,Speech,Tony Jones,"I want to bring you back to the point of the question, which was actually about solar thermal power precisely, which the questioner says can actually produce base-load power. Now, you spend a lot of time in China. You would have seen the conservative British MP Zac Goldsmith saying in the documentary China invested $34 billion in the last year in clean energy. Are we lagging behind the Chinese and the Indians?"
"35,074",148,Speech,Clive Palmer,"I think we're lagging behind a lot of people in a lot of things but the most important thing about clean energy is that the research is done so we can look to the future and look to it positively, whether we do it or someone else does it or we apply it. We have to look at that situation. But as I said, we have to concentrate on solutions, not problems and a solution..."
"35,075",148,Speech,Tony Jones,So what about base-load solar power? Solution for you or not?
"35,076",148,Speech,Clive Palmer,"Well, it's got to be competitive but the solution, if we have a look at 97% of carbon comes from natural causes. Three per cent comes from human beings."
"35,077",148,Speech,Anna Rose,"Well, that's a bit misleading, Clive."
"35,078",148,Speech,Clive Palmer,"Hold on, nobody has concentrated on that 97%, the great bulk of carbon dioxide. Maybe we've got to have a proper balance. Maybe we've got to have new scientists. I'm happy to invest a billion dollars in looking at natural carbon and seeing how we can change it. If the Australian government will do that, I'm happy to do that."
"35,079",148,Speech,Tony Jones,What about a billion dollars into solar energy?
"35,080",148,Speech,Clive Palmer,"Well, solar energy, of course, is manufactured cheaper in China than anywhere else in the world and they've proven that because they've got a lower cost of manufacture by using fossil fuels in the manufacturing process."
"35,081",148,Speech,Tony Jones,"Okay, I'm going to go to someone - we've actually got someone in the audience who's Matthew Wright. He's the Executive Director of Beyond Zero Emissions. He believes cheap solar base-load power is possible. Tell us about that briefly?"
"35,082",148,Speech,Matthew Wright,"Well, basically in Spain they've got giant plants already operating. They're large fields of mirrors - a sea of mirrors that surround a central tower and they concentrate the sun's rays to the top of the tower. Passing through the top of the tower is molten salt and they store the hot salt, after it's moved from the cold tank to the hot tank, ready for night time dispatch, so they can run water past the salt. It flashes to steam and it drives a conventional steam turbine, the same one in a coal plant. They're building bigger ones in the US now, 110 megawatts and they're continually scaling these up, backed by the US Department of energy lines program. We can build those too here in Australia and as they build each additional plant, the cost comes down. Now, we saw that with rooftop solar, where two years ago systems for people's roofs cost more than double what they do today. That's unsubsidised costs, I'm talking about. They've halved in price and they halved through deployment, so the Bjorn Lomborg answer is not the answer because that's research without deployment. Leave a bunch of nerds in the corner to research for ten years and you get a nerdy answer. But if you dovetail research with deployment, then you actually get the best outcome and the best bang for your buck so you need to deploy and have research feeding back into that. We need that for base-load solar. We need that for rooftop solar and we..."
"35,083",148,Speech,Tony Jones,"Okay, everyone's going to know how much it would cost? What sort of investment would be necessary in Australia to produce solar base-load power, this solar thermal system you're talking about?"
"35,084",148,Speech,Matthew Wright,"Well, we did a research project with the University of Melbourne Energy Research Institute and we came up with $37 billion a year, so less than 3% of GDP would get us there over ten years. So if we wanted to do it really fast, if we wanted to get it done in a hurry because we need to, that's the state of the climate, then we can get it done in ten years. It's less than what we spend on new motor cars, which we mostly import. It's less than what we spend on insuring our houses and there's less likelihood that Nick's house is going to burn down than climate change is going to be a serious threat to us and I wonder if Nick actually insures his house."
"35,085",148,Speech,Nick Minchin,Better expenditure than the NBN.
"35,086",148,Speech,Tony Jones,"Well, I want you to respond to it because you raised the challenge to scientists and others in the community to basically prove whether or not it could be done, whether you could have solar power cheaper than gas and fuel. Here's someone who says you can."
"35,087",148,Speech,Nick Minchin,"Well, we haven't answered that question, what's the unit price of electricity produced there as compared to a coal station?"
"35,088",148,Speech,Matthew Wright,"Well, initial ones we deploy are going to be 20 cents a kilowatt hour unsubsidised, which is obviously higher than a new build coal, which will be 12 cents, all right?"
"35,089",148,Speech,Nick Minchin,"But the point is that there's been lots of new build coal plants being built. They're being stamped out in China at a fair rate, so they're not coming down any cheaper, okay, whereas we only need to deploy a number of solar thermal plants, you know, one, two, three, four, five, do that in tandem with the US and Spain and other places, and the price will come down quickly and will be close to comparable with..."
"35,090",148,Speech,Tony Jones,"Okay, let's hear - okay, Nick Minchin, former finance minister. Used to be in government. Would you advise governments to look seriously at this kind of investment?"
"35,091",148,Speech,Nick Minchin,"No, I wouldn't."
"35,092",148,Speech,Tony Jones,I mean you said it's a better investment than the NBN for example.
"35,093",148,Speech,Nick Minchin,"That was facetious. I don't think governments should be investing that sort of money in power stations. I mean I'm an advocate of governments getting the hell out of owning and operating sources of power, so it shouldn't be government and the point of the Lomborg advocacy is to ensure that the private sector will willingly take up investment in these things because it can produce affordable power and that's what we need. You can't have..."
"35,094",148,Speech,Tony Jones,Provided there's $100 billion fund.
"35,095",148,Speech,Nick Minchin,"You know, governments can spend money on anything they like, anytime they like. Most of it they waste, I've got to say, and for governments to start investing in this would be like them owning the power stations and it's been part of our problem because they didn't invest in the transmission (indistinct)..."
"35,096",148,Speech,Tony Jones,Okay. (Indistinct)
"35,097",148,Narrative,,MULTIPLE SPEAKERS TALK AT ONCE
"35,098",148,Speech,Nick Minchin,So no government but I want private sector investment.
"35,099",148,Speech,Clive Palmer,There's no shortage of money if it's cheaper. That's the whole point.
"35,100",148,Narrative,,MULTIPLE SPEAKERS TALK AT ONCE
"35,101",148,Speech,Matthew Wright,The issue is - the issue is the research...
"35,102",148,Speech,Clive Palmer,"(Indistinct) there's no shortage of money but people don't want to put money into academics doing research that hasn't got an application. If it's really, really cheaper, industry will provide the money. Our banks will provide the money. I'll provide the money if it's cheaper but, you know, they're not going to do it if it's not cheaper. You're saying 20 cents..."
"35,103",148,Speech,Matthew Wright,"It needs to come down the cost curve, just like coal has come down the cost curve. Just like gas came down the cost curve."
"35,104",148,Speech,Clive Palmer,"Well, you do that (indistinct)..."
"35,105",148,Speech,Tony Jones,Okay. All right. We could actually have this little...
"35,106",148,Narrative,,MULTIPLE SPEAKERS TALK AT ONCE
"35,107",148,Speech,Tony Jones,One more point.
"35,108",148,Speech,Matthew Wright,"The research and development in isolation with the nerds working in the universities or at CSIRO without having the commercial guise to build the plants at the same time and take the feedback, it doesn't work. You've got to build the plants..."
"35,109",148,Speech,Tony Jones,"All right. Matthew, can we hear from one of the nerds in CSIRO? The chief nerd, in fact. What do you think about these ideas?"
"35,110",148,Speech,Megan Clark,"Yeah, I'm very happy as the chief nerd and, look, we are working on the next generation solar concentrator and to bring that price down. We need to bring the price down. There's no question. We also need to optimise the storage so that we can use it for base-load and it needs to be more efficient. What we're doing that though is we're doing that with industry partners and we've got partners who are prepared to put money in because they are also recognising that if we can address those issues and if we can get down to a cost that is comparable or even better..."
"35,111",148,Speech,Tony Jones,"Well, let's remember what our first questioner said. The energy departments of India, China and the US are all saying solar will be cheaper than coal within the next few years. In fact, when you look closely at what they're saying, they're saying between 2018 and 2020. Do you agree with that? Is that possible?"
"35,112",148,Speech,Megan Clark,"Look, our projections are certainly not in the next few years. Our projections are that we will need some further R&D to be able to bring it down to a cost that's even cheaper. If you really want it to walk out the door, make it cheaper than the cheapest fossil fuel plant that we have. But in the meantime we need to have sensible transition plans before we get to those solutions."
"35,113",148,Speech,Tony Jones,Let's go to Rebecca Huntley. What do you suppose - you look at what the public feels about issues like this.
"35,114",148,Speech,Rebecca Huntley,Yeah.
"35,115",148,Speech,Tony Jones,"What does the public think about renewable energy and the possibility of actually replacing, let's say, fossil fuel energy with clean energy?"
"35,116",148,Speech,Rebecca Huntley,"Well, that's been a debate amongst Australians for much longer than when Nick and Anna had that kind of, you know, kind of that moment on the beach together of realisation and that was supposed to be a kind of a light bulb moment for both of them but actually that's the kinds of conversations that people have been having, you know, for at least five years, if not more, and I think the thing that interests me is that we'll be sitting in a group of climate change deniers, people who don't think it's happening or think that we can't really do anything to control it, who will say, but we need to drive smaller cars and we need to have solar panels and we need to have fuel efficient everything in our lives so instead of a debate endlessly about the science, I think there already exists a consensus amongst Australians that something needs to be done and whether we do it for short term economic reasons or long-term environmental reasons kind of doesn't matter so, you know, there's a lot of support out there publicly (indistinct)..."
"35,117",148,Speech,Tony Jones,Let's go to Anna Rose on this and I mean did you feel that light bulb moment slightly dimming as Nick Minchin started talking about the economics of doing these things?
"35,118",148,Speech,Anna Rose,"It makes economic sense to act on climate change. In fact, to not act on climate change, to delay, is the worst thing that we could do to our economy. We had Sir Nicholas Stern in the UK doing a report about the global economic impact and he said that the impact of climate change would be the same as both world wars and the depression at the same time. Do we want to be doing that to our economy? I don't think so and then you bring in the health impacts. You've got the Australian Medical Association saying that climate change is a real and imminent threat to the health of Australians. The impact on our agriculture - I come from a farming family. You look at what's happening to the Murray-Darling Basin, the projections of agricultural decline between 92 and 97% by the end of the century, all of these things will be extremely harmful to our economy and our way of life."
"35,119",148,Speech,Rebecca Huntley,"And I think that's another thing that - you know, I remember we did a group a couple of years ago and one of the guys in that group said if we don't do anything about the environment, Australia will be a third world country and 15 years ago - I go back and look at our research. It's 35 years old. Somebody said, ""If we do do something about the environment, we'll be a third world country."" So, actually, we've now changed our view that actually to be - not only to do something about the environment but also to be at the forefront of innovation about the environment is crucial for jobs in the new century. But I think the one thing that I'd say, Anna, and I think one of the difficulties and, I mean, Nick said this in the documentary, some of these scenes of catastrophe about what's going to happen in the future, is one of the things that gets people, even who believe in climate change, backing away a little bit from the environment movement. Even if those projections are true, it's a little bit - it feels to people a little bit like, you know, those people who wear those sandwich boards saying the end of the world is nigh. If we're going to say - you know, they are concerned about it. They believe it's going to affect them in their lifetime, certainly in their children and their grandchildren's lifetime, but these kind of apocalyptic views about the future, I think one of the things I would like the environment movement to do is tone that down when you're talking to the majority of people who kind of think climate change is happening, what's my role in it and where's it going to go."
"35,120",148,Speech,Tony Jones,We've got a question that actually reflects that. It's from Gordon Hinds in the audience.
"35,121",148,Speech,Gordon Hinds,"Thank you, Tony. It's probably to the panel but to Nick mainly. Are we too wedded to our lifestyle to embrace change? And is it possible that persuading people that our lifestyle is not sustainable is akin to convincing people that smoking will harm - young people with smoking will harm them in their old age?"
"35,122",148,Speech,Tony Jones,Nick Minchin?
"35,123",148,Speech,Nick Minchin,"Well, wedded to our lifestyle is a fairly loaded remark. I mean I think it's fantastic that Australian Governments of both persuasions have produced one of the most prosperous nations on earth and I think we should all aspire as people in public life to produce the maximum level of sustainable prosperity that we can. I suppose what you're asking is: is that sustainable? And that does actually go to this scientific question because we, as I said before, are blessed with hundreds of years of coal and gas resources. We're discovering new sources of gas every day. This whole coal seam gas is opening up enormous new horizons. So, you know, from my point of view I think our lifestyle in terms of modern Australia is perfectly sustainable and so but that doesn't negate the point I was previously making that at some point there is going to be a transition. I mean I actually think nuclear should be discussed in this debate as well as a transitional fuel. So I think we can sustain our lifestyles."
"35,124",148,Speech,Gordon Hinds,"This is about making - if people have got an issue with, you know, is this going to impact or is it not going to impact, which is the point of the documentary, I guess you guys were both representative of different polars, then isn't it akin to sort of also that question mark about when you try and tell a 14 year old not to smoke because they'll get cancer when they're 65? I mean there is a sort of - there's an analogy there that is that..."
"35,125",148,Speech,Tony Jones,"The smoking analogy mightn't work quite so well with Nick Minchin. He's against public campaigns against smoking, I think."
"35,126",148,Speech,Nick Minchin,"Well, hang on a minute. I've never smoked."
"35,127",148,Speech,Gordon Hinds,"No, I'm saying the reality of what you're trying to achieve, you know..."
"35,128",148,Speech,Nick Minchin,"That's a crazy analogy, I'm sorry, in my view but..."
"35,129",148,Speech,Gordon Hinds,Why is it crazy?
"35,130",148,Speech,Nick Minchin,"Well, I don't get it. I mean that's a personal health..."
"35,131",148,Speech,Gordon Hinds,"I don't think it's crazy, Nick."
"35,132",148,Speech,Nick Minchin,"I think there's enough evidence - you know, it's a question of evidence. There is enough evidence that smoking is bad for your health. I've never smoked..."
"35,133",148,Speech,Gordon Hinds,"No, I mean like when you're 14 you say to somebody..."
"35,134",148,Speech,Nick Minchin,...and I discourage my children from smoking but...
"35,135",148,Speech,Gordon Hinds,...when you're going to be 60...
"35,136",148,Speech,Tony Jones,Okay. All right. All right. I think we won't spend too much time on the analogy.
"35,137",148,Speech,Nick Minchin,"No, I don't get it."
"35,138",148,Speech,Tony Jones,I would like to hear from Megan Clark though. Does Australia need to change and have a more sustainable - do we need a more sustainable country and particularly our energy use?
