"id","episode_id","event","speaker","text"
"35,139",148,Speech,Megan Clark,"Well, I think it's a much broader issue than just the climate. We're looking at how do we live in a world where the resources themselves are going to be restricted on a number of fronts? You know, we know in the next 60 years we have to produce as much food as we've ever produced in human history. We are also looking at our water resources so this is a much broader issue but when you're trying to get positive change, positive impact from science and technology, it really helps if what you're offering is better than what you have so I can maintain a prosperous lifestyle and that walks out the door. So, for example, when we had to address the ozone issue with CFCs, we had recognition, observation of the issue. We had recognition from the public and everyone learnt about what on earth ozone was. We then had sort of policy and guidelines. But what really happened with the change was the minute that refrigerators and new coolers were produced that were better than what we had, that were more efficient and cheaper and easier. Then that change was very easy and I think that's the challenge."
"35,140",148,Speech,Tony Jones,"So very briefly, is it CSIRO's view that climate change is forcing serious change on our economy, on our energy use patterns and so on?"
"35,141",148,Speech,Megan Clark,I think the whole issue of operating in a world where our resources are going to be restricted is something that we all have to come to grips with. Certainly from CSIRO's point of view we're working across a number of fronts and particularly working on how you have pathways to a future that we can all accept because it's only when you get a pathway to the future that we agree on that we'll start going there.
"35,142",148,Speech,Tony Jones,Anna Rose?
"35,143",148,Speech,Anna Rose,"Completely agree with Megan. We have the opportunity in our generation to - everyone alive today to create a really bright future for Australia, to harness our renewable energy resources, to build new innovative industries, to create new jobs and to get our carbon emissions down. Now, one thing that's been discussed is the time frame in which we do it and that is key because we have the International Energy Agency this is a very conservative international body - saying we've already used up 80% of the emissions budget that would keep the world under two degrees of global warming. Now, every mum and dad out there who does grocery shopping every week knows that when you've used up 80% of your budget you don't keep spending. You start saving and that's what we've got to start doing. We've got to start saving energy. We need to the infrastructure in place so that we can move to that low carbon economy and according to the IEA we have to do it before 2017 globally."
"35,144",148,Speech,Tony Jones,"Okay. All right. Let's go to Clive Palmer, who is shaking his head, and I'll bring you back..."
"35,145",148,Speech,Clive Palmer,"Well, look, you know..."
"35,146",148,Speech,Tony Jones,"The question was: are we too wedded to our lifestyle to embrace change? You may like to suggest we don't need to change, I don't know."
"35,147",148,Speech,Clive Palmer,"Well, certainly people have got needs that have got to be met, you know. The Chinese Government, I've just signed an agreement for $40 billion in coal sales to China so they're pretty happy with that. That's going to employ 10,000 Australians. You want to put all those people out of jobs? You want t have their families so they can't buy presents for their kids at Christmas? That's what we're talking about, you know, and that's the reality of it. That's the reality of it and that's why you'll see that the Federal Government will be thrown out at the next election because Australians want jobs. They want some prosperity and that's the simple facts of life. You can talk about what may happen in the future. I agree with the whole panel. We've got to do all we can to make sure we've got a better energy source in the future but it's got to be cost competitive. When it is cost competitive, if it's developed by industry, you don't have to have these arguments, it will happen. I'll invest in solar panels tomorrow if it's cheaper than digging up coal and everyone will. It's all economically-based and 20 million Australians, you've got to be really joking to think, you know, change the whole globe with our emissions. If you look at how much our emissions are, they're so infinitesimal, they don't make any impact whatsoever."
"35,148",148,Speech,Rebecca Huntley,"Look, I've got to jump in here because I think that the question the man was saying goes to the extent to which people are prepared to sacrifice now for something of benefit in the future and it's very easy for people like Clive to kind of present a commitment to climate change being about you have to turn your television off now. He said before that I had to throw my husband out of bed if I really cared about climate change."
"35,149",148,Speech,Clive Palmer,Only if he's got electric socks.
"35,150",148,Speech,Rebecca Huntley,"Only if he's got electric socks. And so there is this kind of catastrophising, sometimes on both sides, that if you care about climate change you've got to kind of wear sackcloth, live in a humpy and kind of, you know, eat yoghurt for the rest of your life."
"35,151",148,Speech,Tony Jones,There's nothing wrong with that.
"35,152",148,Speech,Rebecca Huntley,You can't have an iPad or any of that kind of stuff and I think that's...
"35,153",148,Speech,Anna Rose,Environmentalists don't say that. That's a stereotype.
"35,154",148,Speech,Rebecca Huntley,No. No. No. I'm talking about that's what the anti-climate change people say.
"35,155",148,Speech,Clive Palmer,I say that. I live in a sack.
"35,156",148,Speech,Rebecca Huntley,I'm saying that that's what the anti climate change people say...
"35,157",148,Speech,Clive Palmer,I love it.
"35,158",148,Speech,Rebecca Huntley,"...we have to do if we care about climate change, kind of reverse civilisation. And it's scare tactics."
"35,159",148,Speech,Clive Palmer,"No, she says we've got to stop coal mining now. That's what she says. We've got to stop, reduce it..."
"35,160",148,Speech,Rebecca Huntley,Does she say that?
"35,161",148,Speech,Clive Palmer,She does.
"35,162",148,Speech,Anna Rose,I say we need to...
"35,163",148,Speech,Clive Palmer,"You do, don't you, yeah?"
"35,164",148,Speech,Anna Rose,We need to transition as soon as possible towards a cleaner energy future.
"35,165",148,Speech,Clive Palmer,"By 2017, you say we've got to reduce it."
"35,166",148,Speech,Anna Rose,Globally we need to have emissions stabilised and reduced.
"35,167",148,Speech,Clive Palmer,"No, 2017 in Australia."
"35,168",148,Speech,Anna Rose,"So, yes, we do need to move away from coal mining."
"35,169",148,Speech,Clive Palmer,"That's right. Our coal mine will be built by 2016 so we'll shut it down after one year and throw away $8.5 billion of Chinese investment, 10,000 jobs (indistinct)."
"35,170",148,Speech,Anna Rose,Maybe you should build solar panels instead of that coal plant?
"35,171",148,Speech,Clive Palmer,"Well, our deputy chairman..."
"35,172",148,Narrative,,APPLAUSE
"35,173",148,Speech,Clive Palmer,"Okay. Our deputy chairman, his company is the largest manufacturer of solar panels in the world, so if you do your research you'll know that. He went to the University of New South Wales here and he's the largest manufacturer in the United States, manufacturing in China and exporting. So, look, we all care about the future. We all care about the air we breathe and the future that we've got but the reality of it is it's got to be economic and the demand has got to be there, then it will happen. Governments can't mandate it. You can't put people out of work. It's not going to be popular but if we make it cheap enough it will work and that's what the CSIRO is saying. That's what everyone says. It's a naïve debate otherwise."
"35,174",148,Speech,Tony Jones,"Okay. You've watching Q&A, the climate special. Some of our viewers may have answered the questionnaire on the I Can Change Your Mind About Climate website. It's based on the Yale survey that Anna and Nick did and in the last few weeks was completed more than 24,000 times. It's not a scientific survey. It uses self-selecting and they can actually fill it out more than once. So those at both ends of the scale, the alarmed and the dismissive, are overrepresented, while the unengaged, not surprisingly, didn't bother to fill it in. But the results do show polarised public debate and that's supported by the CSIRO's smaller but representative study of Australians in 2011, which found 45% of people believe climate change is just a natural phenomenon while 43% believe it's caused by human activity. Our next question tonight comes from Suzy Randjelovic."
"35,175",148,Speech,Suzy Randjelovic,"Thank you. Hi, there. The survey results, as you pointed out, on I Can Change Your Mind show that more than half polled are dismissive. Is this a direct result of how our political leaders have handled the climate change discussion?"
"35,176",148,Speech,Tony Jones,Let's start with Nick Minchin?
"35,177",148,Speech,Nick Minchin,"Well, I share Rebecca's view and I think, if I may without being contradicted by Anna, say that I think that's one of the things Anna perhaps got out of this exercise was that the alarmism and hysteria that some people have brought to this debate from the warmest point of view has been counterproductive and, I mean, I'm just interested in James Lovelock, you know, whose one of the significant green scientist around the world. He's making that point also that alarmism, when it is not substantiated by the evidence, just turns people off and Rebecca is finding that in her work. And that's why I was - I'd like to think that as part of this exercise and as the debate goes on we take the heat out of this, we do talk more rationally and calmly to each other and I do think, to the extent that some politicians have hyped this, as have some scientists, I think that's been counterproductive and cause the division."
"35,178",148,Speech,Tony Jones,You're talked in the documentary about the debate being polarised. Is it hyped on both sides? Would you accept that?
"35,179",148,Speech,Nick Minchin,"Yes. Look, you know, I think that would be churlish of me not to say that. But I think the guilt, I must say, lies first and foremost with those who've said the world is going to end tomorrow. You know the sack and cheesecloth stuff."
"35,180",148,Speech,Rebecca Huntley,"Oh, no, Nick, I don't think - I don't know if that's right."
"35,181",148,Speech,Nick Minchin,"That has lead to - that leads others to respond and say what a lot of nonsense. Nothing's happening. You know, let's just life go on. So, it's chicken and egg."
"35,182",148,Speech,Tony Jones,"Before we go further on that, I just want to hear Rebecca Huntley on this survey. You have had a look at the survey results of the 24,000 people."
"35,183",148,Speech,Rebecca Huntley,Yeah.
"35,184",148,Speech,Tony Jones,So what's your thoughts on the survey?
"35,185",148,Speech,Rebecca Huntley,"Well, it's not a survey. It's not real research. You couldn't call it a survey. I mean the only thing that it's evidence of is that this debate seems to attract."
"35,186",148,Speech,Clive Palmer,It's a lobby group.
"35,187",148,Speech,Rebecca Huntley,"No, it seems to attract tiny percentages of the population who are either who this is their central ideological question and we consistently find in the quality of research we do and the quantity of research we do that the majority of Australians think that climate change is happening but they're divided in many ways about the extent to which humans are involved. But more important than divided about why it's happening, they're divided about what we need to do, what our role should be as individuals, the Government, the international community and that's really where the conversation has to be, not at those extreme ends of the spectrum. And I think this is, you know, you could, you know, line your kitty litter tray with this piece of research."
"35,188",148,Speech,Tony Jones,"Incidentally, the questioner was asking the question whether politicians are driving the survey results."
"35,189",148,Speech,Rebecca Huntley,"Oh, yeah. Look, I think..."
"35,190",148,Speech,Tony Jones,"Political leaders, I think she said."
"35,191",148,Speech,Rebecca Huntley,"I think that's part of it. I mean people look at the climate change debate and they see, you know, people screaming at each other on both sides and placards and all the rest of it. And remember we find that Australian voters are relatively mild-mannered. They don't like that kind of behaviour. They're turned off by it on both sides and I don't think it's fair, Nick, to just say it's the environmental movement that's been alarmist. I think it's been on both levels."
"35,192",148,Speech,Nick Minchin,"No, I acknowledge that it's both sides."
"35,193",148,Speech,Rebecca Huntley,"I think that one of the things that there has been a level of disillusionment with the government response to climate change and some confusion. Why do we have a carbon tax when we could have had an ETS? So that has taken, I think, some of the focus and interest off it so it does - definitely the political reaction shapes public opinion about it but I don't think it's only factor."
"35,194",148,Speech,Tony Jones,"Just briefly, Clive Palmer, on this issue, if you wouldn't mind, and just bear in mind this..."
"35,195",148,Speech,Clive Palmer,"I went to sleep there, Tony."
"35,196",148,Speech,Tony Jones,"Well, both sides of politics have the same target. Both sides of politics believe climate change is real, human induced global warming is causing climate change, both sides of politics believe that. You..."
"35,197",148,Speech,Clive Palmer,"Well, I don't believe it. I mean I don't believe any of it. I think it's all about restricting our trade. I think it's about having these issues for the..."
"35,198",148,Speech,Rebecca Huntley,Is that a CIA plot?
"35,199",148,Speech,Clive Palmer,Well...
"35,200",148,Speech,Rebecca Huntley,"CIA plot, Clive?"
"35,201",148,Speech,Clive Palmer,"Well, most likely, but all I'm saying about it is we've got the developed world telling the undeveloped world they can't have what they've got, that they can't have a lifestyle the same as them and that's wrong. You know, I think that's wrong because we've got to compare about all people regardless of where they live."
"35,202",148,Speech,Tony Jones,"Okay, Anna Rose is shaking her head on that point."
"35,203",148,Speech,Anna Rose,"That's ridiculous. The people who are suffering the most right now from the impacts of climate change are people in less developed countries who are feeling the impacts of sea level rise, of extreme weather events and they don't have the resources that we have in Australia to cope with those kinds of impacts. So to pretend that you care about people in India yet totally ignore the suffering..."
"35,204",148,Speech,Rebecca Huntley,"This is the thing. If climate change is real - if climate change is real, Clive is going to build himself a massive biosphere and he'll just live in the biosphere and he'll be fine. It's all the rest of us that are in trouble."
"35,205",148,Narrative,,MULTIPLE SPEAKERS TALK AT ONCE
"35,206",148,Speech,Tony Jones,"I'm going to interrupt all of you because we can continue this discussion but we can refocus it. The media is often mentioned as cause as well and we have a video question from Keith Martin Smith in Ridgeway, Tasmania."
"35,207",148,Speech,Keith Martin-Smith,"Does treatment of climate change in the media suffered from the balance fallacy: the assumption that all points of view are equally valid? Given that the majority of experts think that climate change is real and anthropogenic, isn't it time the media stopped giving equal air time to the sceptics?"
"35,208",148,Speech,Tony Jones,Megan Clark?
"35,209",148,Speech,Megan Clark,"I think this is a very complex issue and it's one of the most complex issues we have faced as a humanity and we know that if - with any major issue we certainly start with the observations. Then there's public and that often comes from the scientific community. Then there's awareness of those observations and then there's generally a major challenge phase before we move to action and policy. So I think these issues, if we're going to come to grips with them, genuinely do need an honest debate on both sides and what happens, of course, during the challenge phase was actually what happened in the documentary, is you go back to the observations again. Just remind us what we're seeing. It's one of the reasons why CSIRO, with the Bureau of Meteorology, have made the decision that every two years on the same day we'll bring out the state of the nation's climate. Not what could happen, not what might happen but actually what has happened and just provide that information to the Australian..."
"35,210",148,Speech,Tony Jones,"Well, give us a snap shot of what your report is telling the Government about climate change."
"35,211",148,Speech,Megan Clark,"Well, we're telling the Australian people, Tony, because we have certainly had feedback that they want to hear. We're still, seeing since every decade since 1950, each decade warmer than the decade before, even with the two wettest years we had in 2010 and 2011, which were the two wettest years we've ever had on record. We're seeing fewer really cold days, decade after decade. We're also seeing changes in sea level, which are different around different parts of Australia but very consistent with what we're seeing. So we're seeing very consistent trends, particularly in the temperature, and we simply report that. We'll do that two years. We've made the decision to do it on exactly the same day every two years so that it's something that we report regularly. Our belief is that, you know, a decade, maybe even two decades of sharing this information with the Australian people, I think, starts to build trust and provide information that the Australian people are desperately looking for."
"35,212",148,Speech,Tony Jones,"Okay, well, let's hear from Nick Minchin. He's obviously looked at this research. CSIRO is the main scientific body advising Government on this. Do you accept what they're saying?"
"35,213",148,Speech,Nick Minchin,"Well, can I just come back to the question, Tony?"
"35,214",148,Speech,Tony Jones,"You can do both, yes."
"35,215",148,Speech,Nick Minchin,"Sorry, that's normally your line I know, but the question was the balance fallacy and I think one of the really disappointing aspects of this issue is that too many warmists simply want to shut down the debate and pretend that nobody has a contrary point of view and not let anybody like me or Clive or anyone else here have a say."
"35,216",148,Speech,Tony Jones,I'd like to bring you to this point. You were the Minister for Science.
"35,217",148,Speech,Nick Minchin,"Yes, indeed."
"35,218",148,Speech,Tony Jones,CSIRO is the main body advising the Minister for Science. You've just heard their assessment. Do you accept it?
"35,219",148,Speech,Nick Minchin,"And when I was the Minister for Science, the head of Australia's National Centre, Bill Kininmonth, was very much of the view that human beings are not driving global warming. So there is conflicting advice to political people like me when I was in office. The fact is, and even Phil Jones from the you know, the Climate Research Unit at East Anglia, admits that effectively there's been no rise in average global temperature since 1998."
"35,220",148,Speech,Anna Rose,That's not true.
"35,221",148,Speech,Nick Minchin,We're now approaching...
"35,222",148,Speech,Anna Rose,"2010 and (indistinct)..."
"35,223",148,Speech,Nick Minchin,Phil Jones admits it. I don't know why you keep saying that. Phil Jones accepts it.
"35,224",148,Speech,Anna Rose,"Look at the temperature record, Nick."
"35,225",148,Speech,Nick Minchin,"James Lovelock is in here saying it. Basically we've had a plateauing of temperature rise. I mean we are in a warming phase. The world is either warming or cooling. It never stops doing nothing. It's either warming or cooling. We've had a warming phase since the end of the little ice age, 150 years ago. In terms of global average temperature it peaked 1998 and it is effectively stable now, despite the increase in CO2. So there is a major problem with the warmist argument because we have had rising CO2 but we haven't had the commensurate rise in temperature that the IPCC predicted."
"35,226",148,Speech,Anna Rose,"That's just not true, Nick."
"35,227",148,Speech,Tony Jones,"Can I actually go to - we actually have among the experts in the audience, we've got a climate scientist. We've got Matthew England, who is the Joint Director of Climate Change Research and Professor of Ocean Physics, the University of New South Wales. So we'll just get a microphone to you over here."
"35,228",148,Speech,Matthew England,"I am miced up, I think. I miced up, I think."
"35,229",148,Speech,Tony Jones,You're miced up. I'm so sorry.
"35,230",148,Speech,Matthew England,What Nick just said is actually not true. The IPCC projections of 1990 have borne out very accurately the projections now 22 years old and the temperature record that we have does bounce around from year to year but that decade by decade progression of warming that Megan just mentioned has occurred. We can go back further in time than that. Jim Hanson had projections in the 1970s that have played out and we can actually go back through the last century of science and see there's been a gradual progression of scientific knowledge that's built up to certainty about some of these issues.
"35,231",148,Speech,Tony Jones,"Okay, thanks for and I'm going to go to a video question on this subject. It's from Michael Wrathall in Seaforth New South Wales"
"35,232",148,Speech,Michael Wrathall,"Dr Clark, the CSIRO's position on human induced climate change is clear, however the organisation no longer commands the unchallenged respect within our political and public debates in this country. Why is Australia no longer listening to you and what can be done about it?"
"35,233",148,Speech,Tony Jones,Megan Clark?
"35,234",148,Speech,Megan Clark,"Well, first of all, both national and state assessment of the population in Australia says that CSIRO is the most trusted brand in science and technology and that's a most recent surveys, so just to correct there. But the question is a broader question."
"35,235",148,Speech,Tony Jones,"Except that half the people in Australia seem to have a different view or at least half the people who answered our survey, that's for sure."
"35,236",148,Speech,Megan Clark,But the question here is has the scientific...
"35,237",148,Speech,Tony Jones,"And half the people who answered your survey, now that I think about it."
"35,238",148,Speech,Megan Clark,"But has the scientific community done enough to share their information? And I would be the first to admit that I think the scientific community has a long way to go to be able to represent both the risks and the opportunities that we see and I think we could do a much better job. The scientific community has been used to talking to the scientific community. As Rebecca outlined, there's a long way to go to be able to speak, I think, clearly and simply across a much broader spectrum. But let's be clear, the evidence is compelling and the scientific community must also shift not just from talking about the observations but we are part of the solution. Our future will be defined by the science and technology that we're working on now and so our scientists spending more time both on the solutions that we will all embrace in the future, because they really represent a better way to live, and the sensible pathways that will get us there and preserve, you know, our prosperity and our competitors in a global scene."
"35,239",148,Speech,Tony Jones,I'd just like to hear from Rebecca Huntley. Why do you think that it is that the CSIRO's own survey shows that half the people don't believe seem to believe in the science?
"35,240",148,Speech,Rebecca Huntley,"I think it goes back to people's understanding of science more broadly, which as any research that shows in Australia isn't great and, in fact, the research that we released this week showed that only about 50% of the people we polled felt they could understand the scientific reasons behind climate change and of those people who said they could, they nominated things that haven't got much to do with climate change like litter. So I think that we're coming from a low knowledge basis and that's why often I think when the debate about climate change becomes about these kind of fine debates within the scientific community about data, you lose people and so in the end they fall back to some basic ideological or value based systems or personality based systems. And when you did that when the two of you did that survey with the Yale guy, he wasn't testing your understanding of the science, he was testing those broader value sets so it's difficult. I mean the CSIRO still is a very trusted organisation but broadly what scientists are telling us about this complex and in some ways scary issue, I think it's quite natural for people to say I don't really want to have to believe that because it is scary for some people."
"35,241",148,Speech,Tony Jones,"Just before I move onto our next question, and we do have a question, Clive, hold your horses, because it's one you will want to answer."
"35,242",148,Speech,Clive Palmer,"Well, good."
