"id","episode_id","event","speaker","text"
"35,243",148,Speech,Tony Jones,"We've got a question - we've actually got in the audience - we were talking about the psychology of the way people think. We've got Ben Newell, the Associated Professor of Psychology, University of New South Wales, also the co-author of a book Straight Choices: the Psychology of Decision-making. Let's hear from Ben."
"35,244",148,Speech,Ben Newell,"I would agree with Rebecca that part of the problem here is that people do find it difficult to understand some of the science and so you have to then rely on your own experience and I thought it was very telling in the documentary. Anna's uncle, Geoff, was someone who experienced for himself changes in what was going on in the climate and he could see because he had that affinity with the land. Most of us don't have that so most of us have to rely on personal experience, which is our experience of the weather, not of the climate and so we make judgments on a day to day basis and research shows that you ask people on a cold day do they believe in global warming, they believe it less than if you ask them on a hot day. So we now that, you know, our beliefs are very labile."
"35,245",148,Speech,Tony Jones,"And what about the fact that it's been talked about by a number of our panellists, which is the fear aspect? How do people respond psychologically when they're told the world is coming to an end?"
"35,246",148,Speech,Ben Newell,"I think it's a very important point that Anthony Leiserowitz brought up that that doom and gloom, that fear is not an emotion that can support action for a long timing and that people talk about having a finite pool of worry so you can worry about a certain number of things but not too many more and I think one of the reasons why climate change came off the agenda, especially in the US over the last few years, is because the economy crash and suddenly the economy was the thing that people worried about and climate change was too far off the list and so..."
"35,247",148,Speech,Tony Jones,So let's go to Anna Rose on that briefly and then we'll go back to the floor for other questions but I'd like to hear your views on that and whether the environmental movement as a whole has something to answer for here?
"35,248",148,Speech,Anna Rose,"Well, there's a difference between alarmism and facts that are true but make people uncomfortable or alarmed. So the things that we're hearing from scientists often are quite confronting because we're talking about serious changes to our economy, to our health, to our agriculture, if we don't act on climate change. But back to the question as to why there is some distrust in the community or their unsure about the science, let's not forget that we have had a concerted campaign over the past decade from vested interests who are opposed to cutting carbon pollution and, in fact, every single person that Nick took me to meet except one had affiliations or was receiving funding from the Heartland Institute. Now, this is a conservative, US-based think tank."
"35,249",148,Speech,Clive Palmer,"Evil body, yeah."
"35,250",148,Speech,Anna Rose,"It gets money from Exxon Mobil, from oil companies, from big tobacco and from corporations who are opposed to any kind of regulation."
"35,251",148,Speech,Clive Palmer,From the Rockefellers.
"35,252",148,Speech,Anna Rose,"So I think it's actually in the face of this campaign to discredit scientist, I think it says a lot about Australians' commonsense that actually according to the survey that came out today, 90% of them do still accept that climate change is happening and that it's at least partially caused by humans."
"35,253",148,Speech,Tony Jones,Let's go to another huge issue that bothers a lot of people. Our next questioner is Leon Ashby.
"35,254",148,Speech,Leon Ashby,"Okay. The Chinese community or the Chinese in China continually increase their carbon dioxide carbon dioxide emissions by Australia's total every four months. To put that in context, when Australia decreases its carbon dioxide by 5% in the next ten years as the carbon tax or the direct action plan promises, the Chinese will have nullified our efforts 3,600 times over as they will have nullify our 5% reduction every six days. Doesn't this amount to Australia's efforts being as effective as piddling into a blizzard?"
"35,255",148,Speech,Tony Jones,"Well, start with Clive Palmer."
"35,256",148,Speech,Clive Palmer,"Exactly. I just think that's true. It is true and we know $34 billion has been set aside for solar research in China but we also know that they're currently mining coal at the race of 46% of the world mining rate and have only got 14% of the reserves because they want their people to have a better lifestyle and those basic drivers for people to be able to educate their children to live in decent houses to have a full belly, if you like, are much stronger. You know, it's very, very easy when you can eat, live in a great society like we've got in Australia, to have the luxury of having these sort of views and very difficult if you're fighting for survival, if you're living in a village and you're starving to death and you try to convince somebody then that they shouldn't have free access to power and a low cost for their family and for their futures. Very difficult."
"35,257",148,Speech,Tony Jones,"Anna Rose, do you want to answer that?"
"35,258",148,Speech,Anna Rose,"I'm really glad you asked that question because sometimes you do hear it come up. Now, no one country can solve climate change on our own. It's just not possible. It's a global issue but imagine that you were a grandfather of a teenage boy who was trying who was taking up smoking and you, as a grandfather, your objective is to get this kid to not smoke because it's bad for their health. If you're sitting there puffing away on a cigarette saying, ""Give up smoking. It's bad for your health,"" that teenager is not going to give up smoking. Australia is - in that example, we have the highest per capita emitter of the OECD countries. That makes us the grandfather and if we're going to say to the other countries in the world that you should not pollute as much, then we need to be showing some leadership ourselves before we can make that kind of statement."
"35,259",148,Speech,Tony Jones,"Nick Minchin? Well, Megan Clark wants to jump in there so we'll go to her first."
"35,260",148,Speech,Megan Clark,"Yeah, we produce 1.3% of the world's emissions and so if this issue is going to be addressed globally it does need to have a global reaction. But, you know, I'm from the scientific community and we have 2% in Australia of the world's knowledge and yet that doesn't stop our scientists working, you know, day and night and staying up at night to work on the science and technology that you will be reading about tomorrow in the newspaper. I think if you went to any one of our Olympians and said, ""Look, there's no point in going to London because statistically you're only 2% of the world's population. You're just not going to win anything,"" I think they'd probably punch you in the nose. So we do have a responsibility to the globe but we also must recognise that we are 1.3% of the emissions and this will require a global solution and we're not the only ones. We're not the only ones that need to (indistinct)."
"35,261",148,Speech,Tony Jones,I'm just going to get straight in with another question. It comes from Brian Ford. Then we'll bring the rest of the panel in. Brian.
"35,262",148,Speech,Brian Ford,"Hey. Hi, there. Just before I give you the question, I'd just like to thank the CSIRO and I sort of think, you know, like I go to the baker, you know I get bread from the baker. I, you know, go to the doctor, the doctor gives you penicillin or whatever you need to get well. And the scientists, they seem to work all the time at getting facts and studying microscopes, and the critics, the sceptics they just come out and say..."
"35,263",148,Speech,Tony Jones,We go to the audience not for anecdotes but the questions. So what's your question?
"35,264",148,Speech,Brian Ford,"Okay, well, the question here, this is actually from Nicola, who is in my family. She says: could someone tell me what percentage Australia produces in carbon compared with the total world output, including nature, like volcanos, cows and animals, et cetera? And can this percentage be compared to the percentage of manufacturing we are going to lose to other countries who don't pay a carbon tax?"
"35,265",148,Speech,Tony Jones,"Okay, let's go to our scientist, Megan Clark?"
"35,266",148,Speech,Megan Clark,"Well, I can't answer the second part of that but, as I mentioned, you know, we produce 1.3% of the world's emissions and so I think that covers your first question. Your second part of it was a little complex."
"35,267",148,Speech,Brian Ford,It is.
"35,268",148,Speech,Megan Clark,But I'm sure we've got a couple of scientist that will stay awake tonight to give you that answer.
"35,269",148,Speech,Tony Jones,I think the argument was that - the essence of that question was that anthropogenic CO2 emission pales into insignificance by comparison to other things. I think that's what he was saying.
"35,270",148,Speech,Brian Ford,About 3%.
"35,271",148,Speech,Tony Jones,So what do you say to that?
"35,272",148,Speech,Megan Clark,"Well, it's certainly - we know the contribution but we have also seen in the past that a small contribution to the atmosphere can make a big impact. We saw that with CFCs. We have also seen it with sulphur dioxide, where we saw the emissions of that causing the acid rain effects from the United States into Canada. We've also seen it as well with nitrous oxide so we know that..."
"35,273",148,Speech,Tony Jones,So I'll go back to a...
"35,274",148,Speech,Megan Clark,...small amounts can...
"35,275",148,Speech,Tony Jones,"Well, I'll go back to..."
"35,276",148,Speech,Megan Clark,...affect the atmosphere significantly.
"35,277",148,Speech,Tony Jones,"Sorry, I'll go back to a climate scientist on this because it's a complex question."
"35,278",148,Speech,Matthew England,"Thanks, Tony. I don't know where the 3% number is coming from because atmospheric carbon dioxide levels today are 40% higher than pre-industrial. And actually, we've emitted three times as much as we need to have to account for that 40%. We're very fortunate that the oceans have absorbed a third of our emissions to date and the land surface, the vegetation and so on has absorbed another third. So, in fact, we've more than done enough to make up for that 40% increase."
"35,279",148,Speech,Tony Jones,Let's go to Clive Palmer on this because I heard you saying you had all the answers a moment ago.
"35,280",148,Speech,Anna Rose,Clive the climate scientist.
"35,281",148,Speech,Clive Palmer,"Well, I'm not talking about science. I'm talking about opinion of people. I mean having a carbon tax in Australia is crazy."
"35,282",148,Speech,Tony Jones,But I think we are talking about science here and the science of...
"35,283",148,Speech,Clive Palmer,"Well, we're talking about carbon in Australia. We know we're dealing with a global atmosphere. So we have a carbon tax here, all we're going to do is lose our industry, lose our jobs to another country who will reproduce them and have the same amount of carbon emissions. That's just crazy. That's what this is all about, exporting our jobs overseas and destroying industrial production in this country and I'm against that."
"35,284",148,Speech,Tony Jones,"Okay, but the question was - I'm just going to bring you to I'm interested in your belief, in fact, as to whether human induced CO2 emissions is leading to global warming and, therefore, climate change?"
"35,285",148,Speech,Clive Palmer,"Well, I think there's no doubt about the fact that human contributions even a small change in the area is very, very significant. You know but I don't believe it's leading to global warming. That's what my personal view is, right. I do believe that there's been an increase in carbon emission. Any small change to the atmosphere can make a major difference but, you know, as I said before natural carbon dioxide is about 97% of the emissions. It's about 3% on an annual basis."
"35,286",148,Speech,Tony Jones,All right. Once again I want to hear the scientists talking to the miner here so.
"35,287",148,Speech,Matthew England,It's a confusion strategy actually by some of the folks trying to derail the science...
"35,288",148,Speech,Clive Palmer,Some of the scientists.
"35,289",148,Speech,Matthew England,"We actually heard the observatory head there talk about the biosphere, you know, respiring and basically breathing out carbon dioxide during the winter and then sucking it down during the summer. So this is a massive cycle of carbon dioxide in and out on a seasonal basis but we have raised atmospheric carbon dioxide by 40% since the industrial revolution and, like I said before, we've actually emitted three times as much as that 40%. I don't know where Clive is getting his numbers from but they're..."
"35,290",148,Speech,Tony Jones,"Okay. I'm sorry to tell you, guys, we are running out of time. During the documentary you may have noticed that we asked viewers to vote on the question would you ever change your mind on climate change? The results are in. 4,730 people voted. 53% say, that, yes, they are open to changing their minds. 47% say, no, they wouldn't. Our next question comes from Phillip Bross."
"35,291",148,Speech,Phillip Bross,"Okay, well, I'm very happy to - by the way it's a great forum today. It's really, really good. Part of my question has already been answered, which is tremendous, and that is that Nick and Anna both have changed their minds slightly during the program that we saw there, which is really good. But part of my question hasn't been answered and that's the question that relates to what are we go doing here in Australia that affects us on a day-to-day basis and that part of the question says that we've introduced new taxes, C02 carbon taxes. Now, that is going to affect our way of living here. It's going to will increase the tax burden to the average family in Australia. So are we jumping the gun by bringing in a carbon tax here when we really haven't solved the debate yet? So that's my question to the panel."
"35,292",148,Speech,Tony Jones,"Anna Rose, we'll start with you?"
"35,293",148,Speech,Anna Rose,"The carbon price is a very, very important first step for Australia because what it does is it starts to transition our economy away from one that's dependent on fossil fuels into one that is moving towards clean energy and it does this firstly by giving polluters a reason to clean up their act, giving them an incentive because they have to pay a small price per tonne of pollution but, secondly, by using that revenue to put into a clean energy, so we have a $10 billion fund, the Clean Energy Finance Corporation, and that's a very, very important first step. Now if you're suggesting that we should wait and just delay, that is not a responsible course of action. When you look at the warnings from the scientists, it would be an irresponsible thing to not take action and to not introduce something like a carbon price."
"35,294",148,Speech,Phillip Bross,"But my questions really - sorry to cut in then Anna but my question really relates to the families in Australia, right? It relates to the issue of what effect does that carbon tax have on the already tax-burdened families in Australia because things after July are going to go up in price exponentially and that is going to have an effect on our family way of living."
"35,295",148,Speech,Tony Jones,"Okay, I'd like to hear from Rebecca Huntley. You're speaking to Australian families."
"35,296",148,Speech,Rebecca Huntley,Yeah.
"35,297",148,Speech,Tony Jones,"Now, is that reflected in that question that concern?"
"35,298",148,Speech,Anna Rose,"Look, there is an anticipation that prices will go up but at the same time there's very little understanding about the compensation package. The carbon tax is unpopular. Tell me the last time a tax was popular amongst people."
"35,299",148,Speech,Nick Minchin,GST.
"35,300",148,Speech,Rebecca Huntley,"And secondly, a tax that's associated with something associated with a Government that's unpopular and also with some confusion about whether the tax will really either help the environment or create the kinds of jobs that we need in a new energy economy. So there is concern about it but I'll be interested to see whether the concern is there in 18 months time and in two years time. It will really depend on how people feel about the kinds of price increases that we've seen. There's assumptions, for example, that the carbon tax will apply to fuel. We've even had people that say the Mr Whippy van will charge us more for our ice cream because of the carbon tax. So there's a concern because there's a confusion about its impact on people."
"35,301",148,Speech,Tony Jones,Clive Palmer has already said it's going to be the end of Christmas presents for miners.
"35,302",148,Speech,Clive Palmer,"Well, first or all we need the tax because Julia needs it. She can't balance the budget. It's got nothing to do with the environment at all. That's the reality of it, right? And the second answer, in 18 months time you won't have to worry because Tony Abbott will be Prime Minister and he's going to abolish it. Hear, hear!"
"35,303",148,Speech,Tony Jones,"All right, I am sorry, we are just about out of time. We can fit in one more question. It comes from Mike Peppou."
"35,304",148,Speech,Mike Peppou,"Climate change appears to be a political poison with Turnbull, Rudd and likely Gillard its first victims."
"35,305",148,Speech,Clive Palmer,"Hear, hear!"
"35,306",148,Speech,Mike Peppou,Is our democracy actually capable of tackling such a fundamental issue?
"35,307",148,Speech,Tony Jones,"Okay, we'll go right across the panel on this, in brief answers. Megan?"
"35,308",148,Speech,Megan Clark,"I think the important thing with democracy is that we need to be able to envisage where we're head heading and we need to have a pathway that people can accept and see their own livelihoods in that pathway. So it's not just about, look, here is something that's a concern and the observations and we really need to move very quickly to this future. If we don't define a sensible pathway, if we don't preserve our prosperity, if we don't have new innovative industries, then we're not going to be able to navigate through that pathway and that's something that we work on, as well, with the community in Australia."
"35,309",148,Speech,Tony Jones,Rebecca Huntley?
"35,310",148,Speech,Rebecca Huntley,"Yes, I think we can do it, yeah. I know we've got one minute. I just saw the sign. I just thought I'd say, yes I this we can do it."
"35,311",148,Speech,Tony Jones,"Yeah, well, I want Clive first (indistinct)."
"35,312",148,Speech,Clive Palmer,"Well, first of all, democracy means about accepting the other person's point of view if it's supported by the majority and the majority of Australians, we have to accept whatever they come up with in the elections that we have in a democratic society. It doesn't mean having your way all the time, even if you want climate change or carbon taxes or you're against them. It means accepting the other guy's point of view and all Australians should do that. I certainly know if the majority of people vote for the carbon tax I will accept it. Thank you."
"35,313",148,Speech,Tony Jones,Anna Rose?
"35,314",148,Speech,Anna Rose,"You can bring in big reforms and still have vested interests saying that they're a problem and it being unpopular. You know we gave the women the right to vote in this country when a lot of men were opposed to it. We brought in gun control laws where people were opposed to it. We even federated Australia, all the states into one country, when a lot of people were opposed to it. We need politicians - political leaders on all sides to have the guts to stand up for what is right and not just what is popular politically in the short-term. We can achieve it in a democracy but only if people like us, who accept the science, make our voices heard."
"35,315",148,Speech,Tony Jones,"Okay, Nick Minchin?"
"35,316",148,Speech,Nick Minchin,"Yes, of course democracy can handle it and one of the scary things from some of the warmists like Clive Hamilton is they insist that we must suspend democracy in order to deal with this issue. That's pretty scary stuff. But it does a great disservice to democracy when political leaders break their promises on issues like this."
"35,317",148,Speech,Clive Palmer,"That's right. Hear, hear!"
"35,318",148,Speech,Tony Jones,"Well, I'm sorry to say that is all we have time for tonight. Please thank our panel: Rebecca Huntley, Clive Palmer, Anna Rose, Nick Minchin, and Megan Clark. Thank you for joining this special edition of Q&A tonight. We'll be back on Monday live from Melbourne's manufacturing and multicultural melting pot Dandenong. Joining the Q&A panel there will be Cabinet Secretary and local Labor MP Mark Dreyfus; Shadow Industry Minister Sophie Mirabella; the President of the ACTU, Ged Kearney; former Howard Minister Peter Reith; Sudanese youth worker Victor Victor; and actor and comedian Diana Nguyen. So we'll see you again next Monday for the regular Q&A. Until then, goodnight."
